{
  "director_plan_ref": "fixture-scene-1",
  "prompt_sections": [],
  "scene_id": "fixture-scene-1",
  "source_refs": [],
  "state_scope": "PORTABLE_WEB_STATE_ONLY",
  "status": "BLOCKED",
  "validation_warnings": [
    "No model adapter selected"
  ],
  "writer_scene_ref": "fixture-scene-1",
  "writer_what_preserved": true
}
